{
  "schema_version": "attribution/v1",
  "generated_at": "2026-08-01T11:00:00Z",
  "window": { "since": "2026-08-01T00:00:00Z", "until": "2026-08-01T10:00:00Z" },
  "sessions": {
    "exactly_attributed": [],
    "unbound": [],
    "mixed": [],
    "orphan_usage": [],
    "measurement_incomplete": []
  },
  "tokens": { "exact_attributed": null, "total_measured": null },
  "research_eligible": true,
  "violations": []
}
