{
  "schema_version": "attribution/v1",
  "generated_at": "2026-08-01T11:00:00Z",
  "window": { "since": "2026-08-01T00:00:00Z", "until": "2026-08-01T10:00:00Z" },
  "sessions": {
    "exactly_attributed": [{ "session_id": "session:c", "tokens": 400 }],
    "unbound": ["session:a"],
    "mixed": ["session:b"],
    "orphan_usage": [],
    "measurement_incomplete": []
  },
  "tokens": { "exact_attributed": 400, "total_measured": 900 },
  "research_eligible": false,
  "violations": [
    {
      "reason_code": "UNBOUND_SESSION",
      "session_id": "session:a",
      "detail": "no binding-record found for this session within the audit window"
    },
    {
      "reason_code": "MULTI_TASK_BINDING",
      "session_id": "session:b",
      "detail": "session was bound to two different task_run_id values (lane work switch mid-session)"
    }
  ]
}
